id,lat,lng,text,timeStamp,user_id,mb_cluster,db_cluster,cluster
384866427435376641,37.77104064,-122.21106255,I want ice cream!,2013-10-01 02:24:41,734316218,22,4.0,22.04
385209194447523840,37.77193666,-122.2109703,10 days till my birthday! ??,2013-10-02 01:06:43,619751955,22,4.0,22.04
385231580521693184,37.77145185,-122.21117757,I neeeed to move out !,2013-10-02 02:35:40,734316218,22,4.0,22.04
385232003496300544,37.77120645,-122.21126599,Exactly a month away from Lake Tahoe?,2013-10-02 02:37:21,734316218,22,4.0,22.04
385243792871141377,37.77178661,-122.21102785,Studying for this Spanish midterm is no joke. ? I wish my boyfriend were here to help me.,2013-10-02 03:24:12,619751955,22,4.0,22.04
385253370413322240,37.77122974,-122.21115408,Tomorrow shall be.... A shitty day,2013-10-02 04:02:15,734316218,22,4.0,22.04
385276209694654464,37.77186943,-122.21104918,#stressed,2013-10-02 05:33:01,619751955,22,4.0,22.04
385277044478595072,37.77167655,-122.21108994,I have like no passion for anything. :/,2013-10-02 05:36:20,619751955,22,4.0,22.04
385277257284993024,37.77184858,-122.21112097,It sucks to see people who have so much fire and drive about something and I'm just blah about everything.,2013-10-02 05:37:10,619751955,22,4.0,22.04
385277615470153729,37.77173761,-122.2110402,My glass is half empty right now. ?,2013-10-02 05:38:36,619751955,22,4.0,22.04
385283709915500544,37.77131142,-122.21130386,My grandma is coming to town Friday??,2013-10-02 06:02:49,734316218,22,4.0,22.04
385284003403538432,37.77111631,-122.21120502,She asked if she was gonna meet my boyfriend #GeeThanks,2013-10-02 06:03:59,734316218,22,4.0,22.04
385415478379704321,37.77182794,-122.21109023,So not ready for this midterm ???,2013-10-02 14:46:25,619751955,22,4.0,22.04
385487463826735105,37.77138489,-122.21122264,Hubba hubba?,2013-10-02 19:32:28,734316218,22,4.0,22.04
385503110300327936,37.77124453,-122.21112725,I'm in love with my girls gift ?,2013-10-02 20:34:38,734316218,22,4.0,22.04
385505666808311808,37.77096073,-122.21121088,Yo solo quiero darte un beso ?,2013-10-02 20:44:47,734316218,22,4.0,22.04
385651019809447936,37.77115021,-122.21121636,Fruta fresca?,2013-10-03 06:22:22,734316218,22,4.0,22.04
385782171471843330,37.77175147,-122.21112885,I have a midterm in an hour that I haven't studied for and a research paper that I haven't even started due tomorrow. Why am I so calm? ?,2013-10-03 15:03:31,619751955,22,4.0,22.04
385782477517631488,37.77184795,-122.21120646,I have a midterm in an hour that I haven't studied for and a research paper due tomorrow that I haven't even started. Why am I so calm? ?,2013-10-03 15:04:44,619751955,22,4.0,22.04
385782769021747200,37.77185972,-122.21122842,I work well under pressure.,2013-10-03 15:05:54,619751955,22,4.0,22.04
385782922390695938,37.7718873,-122.21116489,8 days till my birthday! ??,2013-10-03 15:06:30,619751955,22,4.0,22.04
385792775431544832,37.77188935,-122.21116489,Lose Yourself To Dance - Daft Punk &amp; Pharrell ???,2013-10-03 15:45:40,619751955,22,4.0,22.04
385793406779129856,37.77191517,-122.2109392,Pharrell has the finest cheekbones I have ever seen on a man. ?,2013-10-03 15:48:10,619751955,22,4.0,22.04
385794768791285760,37.77186483,-122.21102602,It's Thursday I just wanna chillllllll.,2013-10-03 15:53:35,619751955,22,4.0,22.04
385916662555242496,37.77178021,-122.21099479,I'm so not feelin this essay right now.,2013-10-03 23:57:56,619751955,22,4.0,22.04
385930837381771264,37.77128862,-122.21120318,WORST. FUCKEN. DAY. EVER.,2013-10-04 00:54:16,734316218,22,4.0,22.04
385932418571456512,37.77175176,-122.21108333,These allergies are literally killing me ?,2013-10-04 01:00:33,619751955,22,4.0,22.04
385937622117281792,37.771092,-122.21125811,Going to San Francisco tomorrow ?,2013-10-04 01:21:14,734316218,22,4.0,22.04
385990871272812545,37.77188194,-122.21106305,Finally the weekend! Jk I got class tomorrow. ??,2013-10-04 04:52:49,619751955,22,4.0,22.04
386033003744342016,37.77123525,-122.21125926,There goes my nightmare for a week! http://t.co/FwlAwRxUM0,2013-10-04 07:40:14,734316218,22,4.0,22.04
386034411927400448,37.77113055,-122.21122286,@MachaelTrujillo awww why?,2013-10-04 07:45:50,734316218,22,4.0,22.04
386035115324751872,37.77112743,-122.21117727,Never thought this would happen ?,2013-10-04 07:48:38,734316218,22,4.0,22.04
386035694079987712,37.77114803,-122.21124768,@MachaelTrujillo it's goooood!! I got scared ?,2013-10-04 07:50:56,734316218,22,4.0,22.04
386137165907759104,37.77181639,-122.2110923,TGIF,2013-10-04 14:34:09,619751955,22,4.0,22.04
386137419998711808,37.77182272,-122.21112574,I have approximately 4 hours to grind out this essay. After today's class my conscience will be free from worry. ??,2013-10-04 14:35:09,619751955,22,4.0,22.04
386137490500751360,37.77188973,-122.21114469,Then it's the weekend! ?,2013-10-04 14:35:26,619751955,22,4.0,22.04
386137734034640896,37.77197937,-122.21104218,1 WEEK TILL MY BIRTHDAY!!! ??,2013-10-04 14:36:24,619751955,22,4.0,22.04
386137989576810497,37.77193432,-122.21110563,I'm like foreal counting down the days to my birthday. Turning 20 is a big deal guys.,2013-10-04 14:37:25,619751955,22,4.0,22.04
386171501122027520,37.77184589,-122.21108752,Sooo this wind is kinda creeping me out. ?,2013-10-04 16:50:35,619751955,22,4.0,22.04
386186926870372352,37.77180713,-122.21121694,"Cool, I'm sick and I'm breaking out. ? Stressed out is an understatement. ?",2013-10-04 17:51:53,619751955,22,4.0,22.04
386187041051906048,37.7718104,-122.21114192,I better feel better by next week otherwise going to be a very unhappy camper.,2013-10-04 17:52:20,619751955,22,4.0,22.04
386187853798965249,37.77178714,-122.21122147,Ok so I'm pretty sure I'm going to be balling my eyes out for next week's episode of Glee. #RipCoryMonteith ?,2013-10-04 17:55:34,619751955,22,4.0,22.04
386219628533272577,37.77201697,-122.21092911,My eyes are burning I've been at this essay for 4 hours straight and I'm finally finished. My essay writing skills are definitely improving.,2013-10-04 20:01:49,619751955,22,4.0,22.04
386219937569599488,37.77187603,-122.21110102,??? Thank the lawd for helping me overcome this struggle known as English 1A.,2013-10-04 20:03:03,619751955,22,4.0,22.04
386220080930881537,37.77183169,-122.21117117,Now I get to relax for 5 more hours before I have to go to work. ?,2013-10-04 20:03:37,619751955,22,4.0,22.04
386220144604635136,37.77184807,-122.21114812,I think I deserve a nap. ?,2013-10-04 20:03:52,619751955,22,4.0,22.04
386318136384815104,37.77135271,-122.21118977,Grandma is getting here earlier ?,2013-10-05 02:33:15,734316218,22,4.0,22.04
