id,lat,lng,text,timeStamp,user_id,mb_cluster,db_cluster,cluster
381271634058829824,37.29617052,-121.90902493,And it's gone! @Athletics #allday #homerun @BringerOfRain20,2013-09-21 04:20:15,551667000,78,10.0,78.1
381274113857163264,37.29623419,-121.90903619,@StephenCurry30 is pretty handsome rooting for the @Athletics,2013-09-21 04:30:07,551667000,78,10.0,78.1
381281190516228096,37.2962222,-121.90883711,I should go to that gamma party but I'm just too lazy to get ready,2013-09-21 04:58:14,551667000,78,10.0,78.1
381284946758737921,37.29628319,-121.90867156,If you think you're the only one he's fuxking you're stupid. Girls really need to learn when a guy is serious about them and when theyre not,2013-09-21 05:13:09,551667000,78,10.0,78.1
381285052086095873,37.29627987,-121.90879934,Mistaking sex for love is stupid,2013-09-21 05:13:35,551667000,78,10.0,78.1
381285560217657344,37.29631187,-121.90882289,Some chicks just too blind smdh,2013-09-21 05:15:36,551667000,78,10.0,78.1
381465579091017728,37.29642015,-121.90891086,I really don't like people touching my hair. Yes I know it's kinda long!,2013-09-21 17:10:56,551667000,78,10.0,78.1
381467806006378497,37.29644601,-121.90890801,8 more days till my Lambdaversary!,2013-09-21 17:19:46,551667000,78,10.0,78.1
381493887254016001,37.29625004,-121.9088169,Last day of summer = Lisa a happy camper,2013-09-21 19:03:25,551667000,78,10.0,78.1
381494895615045632,37.29647013,-121.90865926,Dangerous Minds,2013-09-21 19:07:25,551667000,78,10.0,78.1
381495357986713600,37.29643812,-121.90871026,Tell me why are we so blind to see that the ones we hurt are you and me,2013-09-21 19:09:15,551667000,78,10.0,78.1
381513338951192576,37.29621435,-121.90906847,I'm debating whether I should go out tonight now because of the rain #plansruinedpossibly,2013-09-21 20:20:42,551667000,78,10.0,78.1
381515058582269953,37.29613567,-121.9089148,@Anahitiktok @laV3ro on point! Lol I'm not crying playa!,2013-09-21 20:27:32,551667000,78,10.0,78.1
381515736797032448,37.29626317,-121.90905635,Janessa said I'm a meanie aunt lol when I asked why she said because I didn't let her use the restroom first and I laughed lol #innocentkids,2013-09-21 20:30:14,551667000,78,10.0,78.1
381516175340883968,37.29609326,-121.9088863,@Mr4Oh8 is making me wait hella lol ??,2013-09-21 20:31:59,551667000,78,10.0,78.1
381516432401367040,37.29608127,-121.90894573,It's raining it's POURING! ?????,2013-09-21 20:33:00,551667000,78,10.0,78.1
381519025479512064,37.29620863,-121.90891139,I'm bad and that's good. I will never be good and that's not bad,2013-09-21 20:43:18,551667000,78,10.0,78.1
381519141909168129,37.29625201,-121.90900537,#wreckitralph,2013-09-21 20:43:46,551667000,78,10.0,78.1
381523758529269760,37.29613812,-121.90905543,"@Mr4Oh8 ""I'm the first on everyone's cuz I'm the best!"" Um no I'm the best lmao",2013-09-21 21:02:07,551667000,78,10.0,78.1
381525609744056320,37.29625364,-121.90901295,every girl already decided who her victim will be #cuffingseason lmao,2013-09-21 21:09:28,551667000,78,10.0,78.1
381526502027718656,37.29628897,-121.90911299,@Mr4Oh8 ouch! I'm the best youre just hating cuz nobody knows about your team lol who are they again? ?,2013-09-21 21:13:01,551667000,78,10.0,78.1
381528734148222976,37.29615627,-121.90893956,@Mr4Oh8 lol just be glad you like the sharks ?,2013-09-21 21:21:53,551667000,78,10.0,78.1
381534804337893378,37.29638311,-121.90910348,You know I don't how af about Js when I wear outside in the rain lol http://t.co/m8u3i29GVl,2013-09-21 21:46:00,551667000,78,10.0,78.1
381561129039699968,37.29621883,-121.90900862,This warm latte is in point,2013-09-21 23:30:36,551667000,78,10.0,78.1
381561833934446592,37.29633524,-121.90907866,Yay just got confirmation that my diploma will arrive in a couple weeks! Thank God!,2013-09-21 23:33:24,551667000,78,10.0,78.1
381575681282301953,37.29633425,-121.90907841,I really want to dance tonight ?,2013-09-22 00:28:26,551667000,78,10.0,78.1
381578568154640384,37.29615327,-121.90891002,I need to pay attention more,2013-09-22 00:39:54,551667000,78,10.0,78.1
381579511554252801,37.29616187,-121.9089552,"If you aren't going to use your heart, what's the difference if it gets broken ?",2013-09-22 00:43:39,551667000,78,10.0,78.1
381579643892940800,37.29615457,-121.90894531000001,Take a risk. Real talk. Fuck it.,2013-09-22 00:44:11,551667000,78,10.0,78.1
381583445039673344,37.29612665,-121.90917482,Janessa (while hugging her) she goes umm I'm touching your boobs lmao,2013-09-22 00:59:17,551667000,78,10.0,78.1
381927829383815168,37.2963555,-121.90881276,I'm so happy both my teams won! Proud fan of the @Athletics ?????and the  @dallascowboys ?? #winning,2013-09-22 23:47:45,551667000,78,10.0,78.1
