id,lat,lng,text,timeStamp,user_id,mb_cluster,db_cluster,cluster
378182075263631361,37.31518996,-121.92630397,65 days until New Orleans kids!,2013-09-12 15:43:27,152321972,36,15.0,36.15
378182253144055809,37.31516803,-121.92642634,And good morning ?to ya'll by the way.,2013-09-12 15:44:10,152321972,36,15.0,36.15
378198829289324544,37.31557728,-121.92641841,“@Nah: why do girls wear heels to school? ?”,2013-09-12 16:50:02,62933437,36,15.0,36.15
378213267543293952,37.31602351,-121.92624871,School just makes me tired.,2013-09-12 17:47:24,373761273,36,15.0,36.15
378214794001518592,37.31599193,-121.92621488,My lower back is still aching. Why?!,2013-09-12 17:53:28,373761273,36,15.0,36.15
378214936960184320,37.31606091,-121.92629682,@skottrod who's. gaybor?,2013-09-12 17:54:02,373761273,36,15.0,36.15
378214997232320512,37.31632374,-121.92637257,@skottrod what's a gaybor?,2013-09-12 17:54:16,373761273,36,15.0,36.15
378222599400337408,37.31547783,-121.92665855,Support Local Radio! We Are Real Campus Radio! Make sure to run in at http://t.co/JfOkNCpKta or Tap That App… http://t.co/0UluvBPhuG,2013-09-12 18:24:29,307724325,36,15.0,36.15
378266594490982400,37.31547783,-121.92665855,"The days I have school, I sit in a chair for 14hrs. I think it's the reason for the aches in my lower… http://t.co/TXQRD4GsMq",2013-09-12 21:19:18,373761273,36,15.0,36.15
378273905263120385,37.31606529,-121.92630108,@sir_samIam I wouldn't mind ???,2013-09-12 21:48:21,373761273,36,15.0,36.15
378274069998616576,37.31599996,-121.92630734,RT @skottrod: I JUST WANT TO BE LVING IN LA ALREADY!!!!!,2013-09-12 21:49:00,373761273,36,15.0,36.15
378275826032078848,37.31598819,-121.92621114,September 26th is free drive in movie night!!!!! Someone take me!,2013-09-12 21:55:59,373761273,36,15.0,36.15
378276226516795392,37.31597595,-121.92632561,@thebayjayy yessir!,2013-09-12 21:57:35,373761273,36,15.0,36.15
378287572029423616,37.31576049,-121.92636773,I need you badd.,2013-09-12 22:42:40,373761273,36,15.0,36.15
378289778371727360,37.31598677,-121.92631924,@cvf007 @khalessi_408 hahaha. The fact that Carlos is unaware of what Insanity is! HAHAHAHAHAHAHAHA,2013-09-12 22:51:26,373761273,36,15.0,36.15
378290141015457792,37.31587286,-121.92634732,@sir_samIam ok. You can model for me and I'll take it. I'll make sure I get your angles right.,2013-09-12 22:52:52,373761273,36,15.0,36.15
378291106812682240,37.31602285,-121.92626697,@cvf007 @khalessi_408 @athenalovesmac THAT'S THE FUNNY PART! HAHAHA,2013-09-12 22:56:42,373761273,36,15.0,36.15
378292687364833281,37.31597188,-121.92617671,@cvf007 I hope you marry rich.,2013-09-12 23:02:59,373761273,36,15.0,36.15
378293230091001856,37.31597188,-121.92617671,@athenalovesmac @khalessi_408 @cvf007 too bad Carlos doesn't have that option.,2013-09-12 23:05:09,373761273,36,15.0,36.15
378293594815078400,37.31600026,-121.92624879,@thebayjayy you'll be in LA which is 100x better,2013-09-12 23:06:36,373761273,36,15.0,36.15
378301187692298240,37.31604055,-121.92602988,@thebayjayy haha I'll go and we can FaceTime you there!,2013-09-12 23:36:46,373761273,36,15.0,36.15
378301734147211264,37.31605911,-121.92603479,"I'm so cold right now. I want blankets and beds. This winter, my bed and I are gonna have a good time. I just feel it.",2013-09-12 23:38:56,373761273,36,15.0,36.15
378303459511898113,37.3158989,-121.92629665,@khalessi_408 @cvf007 you do not know how much silent library laughing this tweet made me produce,2013-09-12 23:45:47,373761273,36,15.0,36.15
378304521882963968,37.31591063,-121.92621561,"This winter, I want someone to spend a day with me in San Francisco going to art museums and eating clam chowder bowls overlooking the bay.",2013-09-12 23:50:01,373761273,36,15.0,36.15
378314578569863168,37.3158989,-121.926446,@Leeeenlovee doesn't it seem like the most perfect plan!?,2013-09-13 00:29:58,373761273,36,15.0,36.15
378318715458424832,37.31547783,-121.92665855,It's not how much you know it's how much time you have to do it in...... Time &lt; math time... Means time=mathtime... http://t.co/VSTljVPBvF,2013-09-13 00:46:25,802755,36,15.0,36.15
378346583609180160,37.31491403,-121.92579017,"It's crazy man, all the places I've gone and all the people I've met. I've yet to meet people that I've really bonded with..",2013-09-13 02:37:09,307724325,36,15.0,36.15
378545519477288961,37.31517206,-121.92649707,You know I don't play play,2013-09-13 15:47:39,476959691,36,15.0,36.15
378970203646095362,37.31547783,-121.92665855,"I'm at San Jose City College (San Jose, CA) http://t.co/mXdakiUK9I",2013-09-14 19:55:12,110738926,36,15.0,36.15
379693047917072384,37.31605524,-121.92625015,"“@UrbanEngIish: ""What's been good?"" = the amount of time it's been since we last associated has lead me to forget your most current goal.”",2013-09-16 19:47:31,62933437,36,15.0,36.15
379728540453056512,37.31513628,-121.92577602,“@SanJoseSharks: Reminder that you can catch the #SJSharks &amp; Canucks on @NHLNetwork tonight at 7PM,2013-09-16 22:08:33,62933437,36,15.0,36.15
380012968106139649,37.31521305,-121.92599008,Life is amazing but sometimes I miss the good old days with the girls. I think 2009 was a highlight in my life. @TheNub @nickiface,2013-09-17 16:58:46,21440695,36,15.0,36.15
380039195353296897,37.31597301,-121.9263835,My jeans are too tight now that I'm sweating in places I prefer to keep dry.,2013-09-17 18:42:59,373761273,36,15.0,36.15
380063631523979264,37.31547783,-121.92665855,Best school day ever haha #potluck #dessert @ San Jose City College http://t.co/59X6c1X41C,2013-09-17 20:20:05,1561747051,36,15.0,36.15
380125409364279296,37.31602882,-121.92627959000001,"I think it's so hard to come across a person with intelligence, sophistication and maturity these days.",2013-09-18 00:25:34,373761273,36,15.0,36.15
380363191907123200,37.31550474,-121.92530653,If you're one if those people who take the elevator from the 2nd floor to the 1st or vice versa then I have some questions to ask you?,2013-09-18 16:10:26,373407586,36,15.0,36.15
380702685285986305,37.31645634,-121.92577659,la fuerza de nuestra cabeza nos tiene trastornados... http://t.co/eMSZBvnNPW,2013-09-19 14:39:27,195875724,36,15.0,36.15
380704855167205376,37.31644096,-121.92576285,@SassyPhoenixxx @Bbillions I really hope this is true. going through that deep cut right now... #Sadderday,2013-09-19 14:48:05,195875724,36,15.0,36.15
380724772050460672,37.31575712,-121.92636224,a seguir con mi vida sin mirar atras! ?,2013-09-19 16:07:13,195875724,36,15.0,36.15
380724968582959104,37.31543953,-121.92516941,Aiming straight at yo snap cap,2013-09-19 16:08:00,373407586,36,15.0,36.15
380745720069771264,37.31614651,-121.92628638,I'll be better than who you deserve.,2013-09-19 17:30:28,373761273,36,15.0,36.15
380754046723706880,37.31616116,-121.92648758,@erikgibran or just get my own island away from people.,2013-09-19 18:03:33,373761273,36,15.0,36.15
380754196426809344,37.31616116,-121.92648758,@cvf007 it's the best thing in the entire world!!!!!,2013-09-19 18:04:09,373761273,36,15.0,36.15
380758122911916032,37.31573088,-121.92622361,"Work, School and my nanny schedule. ? thank you google. #googleFTW http://t.co/m3ucLscB2K",2013-09-19 18:19:45,195875724,36,15.0,36.15
380762687069618177,37.3161531,-121.92627763,I'm so cold! Always,2013-09-19 18:37:53,373761273,36,15.0,36.15
380768407689658368,37.31547783,-121.92665855,Lightening some swatches! #cosmetology @ San Jose City College http://t.co/cZhOQfD5cg,2013-09-19 19:00:37,1561747051,36,15.0,36.15
380781995049385984,37.31547783,-121.92665855,"I'm at San Jose City College (San Jose, CA) http://t.co/p5SE4yIScg",2013-09-19 19:54:36,802755,36,15.0,36.15
380792056483823617,37.31576673,-121.92629767,"“@DarrenDreger: 7 years, $42 mil for RNH.”",2013-09-19 20:34:35,62933437,36,15.0,36.15
380842213627801600,37.31605825,-121.92629067,I wish I could have subway subs everyday.,2013-09-19 23:53:54,373761273,36,15.0,36.15
380863148628393984,37.31547783,-121.92665855,"I'm at San Jose City College (San Jose, CA) http://t.co/PjFQcS53a2",2013-09-20 01:17:05,156706843,36,15.0,36.15
381195704733278208,37.31547783,-121.92665855,Thanks chloepac for letting me do your hair! @ San Jose City College http://t.co/67moWM9RfD,2013-09-20 23:18:32,1561747051,36,15.0,36.15
381503549865091072,37.3169181,-121.92594758,@mielleemariela completely,2013-09-21 19:41:48,80445607,36,15.0,36.15
382223988144889857,37.31608976,-121.92630106,My ex boy been searchin for a sorry .,2013-09-23 19:24:34,765167990,36,15.0,36.15
382224147314532353,37.31600258,-121.92635362,Some guys just don't get the hint when you wanna be left alone ! Smh. #annoying,2013-09-23 19:25:12,765167990,36,15.0,36.15
382224760706310144,37.31607808,-121.92630334,My professor always pairs me up with THE WEIRDEST &amp; thirstiest people ever. ?,2013-09-23 19:27:39,765167990,36,15.0,36.15
382225429823631360,37.3160784,-121.92630437,"Broken telephone for every single conversation by the time it gets to you , shit switches these days . http://t.co/hkqZ66vRYu",2013-09-23 19:30:18,765167990,36,15.0,36.15
382225649621954561,37.316031100000004,-121.9263326,On my worse behavior,2013-09-23 19:31:10,765167990,36,15.0,36.15
382225892312756226,37.3159693,-121.92637056,"Mfs never loved us , man mfs never loved us",2013-09-23 19:32:08,765167990,36,15.0,36.15
382226268608950272,37.3159693,-121.92637056,Why is my iMessages using my brother email ? Stupid ass ??,2013-09-23 19:33:38,765167990,36,15.0,36.15
382226564101849088,37.31603354,-121.92633239,Thinkin bout moving back to Chicago . I'm so homesick ?,2013-09-23 19:34:48,765167990,36,15.0,36.15
382227662858510337,37.31608004,-121.92630234,I'll change for the right person but the right person wouldn't want me to change ?,2013-09-23 19:39:10,765167990,36,15.0,36.15
382227725437911040,37.31547783,-121.92665855,This better be a sign that I'm getting #cash @ San Jose City College http://t.co/qGoulwwqak,2013-09-23 19:39:25,1561747051,36,15.0,36.15
382227912667062272,37.31605592,-121.92629128,When's the last time you did something for the first time ? You . . . Done done it all,2013-09-23 19:40:10,765167990,36,15.0,36.15
382228205760815104,37.31605592,-121.92629128,Mobbin like the military ??,2013-09-23 19:41:20,765167990,36,15.0,36.15
382230942758100992,37.31600247,-121.92632758,"@NDambiLyric lol , I thought we've always been the murder capital",2013-09-23 19:52:12,765167990,36,15.0,36.15
382231513682567169,37.31600247,-121.92632758,My advice always seems to falls on deaf ears ?,2013-09-23 19:54:29,765167990,36,15.0,36.15
382231708222758914,37.31607529,-121.92630377,I hope he gets better ? poor baby,2013-09-23 19:55:15,765167990,36,15.0,36.15
382231959465758720,37.31597908,-121.92637092,Hey bestie ?? @Calikiddswagg83,2013-09-23 19:56:15,765167990,36,15.0,36.15
382232497402048512,37.31604829,-121.92631064,@YanniVixen_ wassup ?,2013-09-23 19:58:23,476959691,36,15.0,36.15
382232652301881345,37.31604829,-121.92631064,@YanniVixen_ just chillin bruhh,2013-09-23 19:59:00,476959691,36,15.0,36.15
382233826249814017,37.31596104,-121.92631149,I'm hungry af ! Need some donuts .,2013-09-23 20:03:40,765167990,36,15.0,36.15
382552929925730304,37.3157763,-121.92639317,Nothing but hw all day,2013-09-24 17:11:40,476959691,36,15.0,36.15
382639309473738752,37.31547783,-121.92665855,Math and actual LTE service. (@ San Jose City College) http://t.co/24fkMhD97u,2013-09-24 22:54:55,802755,36,15.0,36.15
382912373201178624,37.31486554,-121.92604012,Last time I heard you was playin with emotions and po' pimpin,2013-09-25 16:59:58,765167990,36,15.0,36.15
382923704344535041,37.31547783,-121.92665855,"I'm at San Jose City College (San Jose, CA) w/ 2 others http://t.co/JZX8GjCEts",2013-09-25 17:45:00,25216310,36,15.0,36.15
382939624110190592,37.31604191,-121.92630807,Thank you pops for telling me you switched the data plan...I already used 65% of it in one day! ?,2013-09-25 18:48:15,1094101693,36,15.0,36.15
382940363649859584,37.31603958,-121.92630915,My little nigglets need to come visit ?,2013-09-25 18:51:12,1094101693,36,15.0,36.15
383014069386477568,37.31514305,-121.92585723,Do you speak Trapanese?,2013-09-25 23:44:04,307724325,36,15.0,36.15
383247989981978624,37.31506502,-121.92571867,Yum this English egg muffin is on point .,2013-09-26 15:13:35,130711243,36,15.0,36.15
383251022224695297,37.31520332,-121.92585467,Who is this guy and how does he know my name ?,2013-09-26 15:25:38,130711243,36,15.0,36.15
383251084287827968,37.31526057,-121.9257471,I've seen him maybe somewhere idk ..,2013-09-26 15:25:53,130711243,36,15.0,36.15
383264964368416768,37.31547783,-121.92665855,A little Cassie acapella before class. @ San Jose City College http://t.co/ngCBEqW40n,2013-09-26 16:21:02,373761273,36,15.0,36.15
383270881406894080,37.31588519,-121.92623481,Squad,2013-09-26 16:44:33,476959691,36,15.0,36.15
383369406145126400,37.31547783,-121.92665855,"I'm at San Jose City College (San Jose, CA) http://t.co/8fvpRbx8wn",2013-09-26 23:16:03,802755,36,15.0,36.15
383380584212353024,37.31513381,-121.92637586,Paradise x Coldplay,2013-09-27 00:00:28,53308778,36,15.0,36.15
383385237926842368,37.31638057,-121.92631971,@Cekyr0 gasp!!!!!,2013-09-27 00:18:58,802755,36,15.0,36.15
383686703644282881,37.31439376,-121.92666323,Game day??? #Jags,2013-09-27 20:16:53,1395239478,36,15.0,36.15
384114063929667585,37.31493419,-121.92569028,Pure bullshit,2013-09-29 00:35:03,403771417,36,15.0,36.15
384711690132017152,37.31495967,-121.92635494,"Black people always say ""I'm about to go to the house"" like there's only one house haha",2013-09-30 16:09:49,373407586,36,15.0,36.15
384714612374921216,37.31592749,-121.92631145,"I procrastinate tooo much , that's my problem ?",2013-09-30 16:21:25,765167990,36,15.0,36.15
384730039956537344,37.31547783,-121.92665855,"I'm at San Jose City College (San Jose, CA) http://t.co/SCGmzmxj9k",2013-09-30 17:22:44,25216310,36,15.0,36.15
384749386557046784,37.31530668,-121.92521954,"I'm at San Jose City College Student Center (San Jose, CA) http://t.co/bQUMzii70P",2013-09-30 18:39:36,25216310,36,15.0,36.15
384749462499127296,37.31522747,-121.92556957,"I'm at SJCC Cafe (San Jose, CA) http://t.co/nkmxIoiKmf",2013-09-30 18:39:54,25216310,36,15.0,36.15
384770939344265216,37.31526303,-121.92663535,Tryna figure out which university I wanna go to ?,2013-09-30 20:05:15,765167990,36,15.0,36.15
384771110476083200,37.31518897,-121.92599715,"Smile thru the pain , baby girl . It ain't worth the stress http://t.co/TcvNmPKnlH",2013-09-30 20:05:56,765167990,36,15.0,36.15
384826527415693312,37.31588968,-121.92637813,"“@SanJoseSharks: Doherty, Kearns, McCarthy, Sateri &amp; Tennyson assigned to @WorcesterSharks. Pelech assigned to @SFBulls”",2013-09-30 23:46:08,62933437,36,15.0,36.15
385109622362611712,37.3159944,-121.92619318,No better time than this moment.,2013-10-01 18:31:03,373761273,36,15.0,36.15
385141088551329792,37.31517099,-121.92614048,Got some new beats !!! Bouta work on it !!!,2013-10-01 20:36:05,765167990,36,15.0,36.15
385141163927150592,37.31516947,-121.92599278,Can't wait to go back home ???,2013-10-01 20:36:23,765167990,36,15.0,36.15
385179680237973504,37.31547783,-121.92665855,Whoever knows this song is qualified to be my best friend. @ San Jose City College http://t.co/w3jbSMmzkf,2013-10-01 23:09:26,373761273,36,15.0,36.15
385186756070350848,37.31607827,-121.92642466,Someone take me to the drive in movies. I'm in the mood for a family comedy.,2013-10-01 23:37:33,373761273,36,15.0,36.15
385193156301438977,37.31604673,-121.9262858,"I just put on a sweater. Oh my yes.
Engulf me in your warmth.",2013-10-02 00:02:59,373761273,36,15.0,36.15
385202559293878272,37.31547783,-121.92665855,"I want blankets and sweaters, beds and rainy days. More than anything right now. I've decided that I… http://t.co/IZIvloYy8O",2013-10-02 00:40:21,373761273,36,15.0,36.15
385209875787444224,37.31547783,-121.92665855,"I'm at San Jose City College (San Jose, CA) http://t.co/RAvX4dDHFc",2013-10-02 01:09:25,156706843,36,15.0,36.15
385474868176633857,37.31548743,-121.92675727,The joint got me high,2013-10-02 18:42:25,373407586,36,15.0,36.15
385484555978698752,37.31448789,-121.92630071,Weight room is about to be a struggle... #sore,2013-10-02 19:20:54,1395239478,36,15.0,36.15
385499693846786048,37.31694843,-121.92592258,15 more minutes ?,2013-10-02 20:21:03,372474815,36,15.0,36.15
385799814320906241,37.31518212,-121.92617079,on October 3rd he asked me what day it was. #meangirlsquotes http://t.co/Ka47aafAUt,2013-10-03 16:13:38,195875724,36,15.0,36.15
385803032891371520,37.31581411,-121.9262881,Lot to do today,2013-10-03 16:26:25,476959691,36,15.0,36.15
385804567130013696,37.31507739,-121.92538016,all I want to listen to #haim http://t.co/pVJzdkPwW9,2013-10-03 16:32:31,195875724,36,15.0,36.15
385833106567360512,37.31600192,-121.92620612,"I could be that guy to heal it over time.
And I won't stop until you believe it.
Cause baby you're… http://t.co/7je7rpvj6n",2013-10-03 18:25:55,373761273,36,15.0,36.15
385858363109937152,37.31547783,-121.92665855,Doing a research with my baby love////Fazendo pesquisa com o meu bebê. (@ San Jose City College) http://t.co/SxK0obbDWv,2013-10-03 20:06:17,25093206,36,15.0,36.15
385891685365862400,37.31606175,-121.92628898,I keep myself drowning in responsibilities because I find that I am absolutely no one without any.,2013-10-03 22:18:41,373761273,36,15.0,36.15
386301547942248448,37.31547783,-121.92665855,Televised game #fb (@ San Jose City College) http://t.co/FxwRP7xJjd,2013-10-05 01:27:20,27903468,36,15.0,36.15
