id,lat,lng,text,timeStamp,user_id,mb_cluster,db_cluster,cluster
385703082081800193,38.04783376,-122.14427638,I wish my boyfriend was awake I just wanna talk on the phone till I k?,2013-10-03 09:49:15,337533218,59,8.0,59.08
385746959555784704,38.04839799,-122.14518942,I swear to god I hate oeople,2013-10-03 12:43:36,163359139,59,8.0,59.08
385852486776389632,38.04768515,-122.14422517,I think it's funny that work calls me to tell danny his hours.,2013-10-03 19:42:56,337533218,59,8.0,59.08
385869853241778176,38.04781859,-122.14431176,French bread pizza &amp; some fat dabs ???,2013-10-03 20:51:56,337533218,59,8.0,59.08
385869965779169280,38.04775208,-122.14422106,still flattered ?,2013-10-03 20:52:23,337533218,59,8.0,59.08
385871925659967488,38.047797,-122.14390204,let's play how many days can gillian go without being with her boyfriend,2013-10-03 21:00:10,337533218,59,8.0,59.08
385913896155897856,38.04834107,-122.14506931,I GOT THE JOB !!! ????????????????,2013-10-03 23:46:57,163359139,59,8.0,59.08
385916997281648640,38.0482917,-122.14530442,“@allysonbrooke_: Congrats to my baby @IamHeartless_ for getting the job at Round Table ??” thank youuuuu ??,2013-10-03 23:59:16,163359139,59,8.0,59.08
385944273641689088,38.04833095,-122.145263,I'm so juiced I got a job.,2013-10-04 01:47:39,163359139,59,8.0,59.08
386003382256668672,38.04779185,-122.14429297,rip to my old laptop &amp; all the music I lost ???,2013-10-04 05:42:32,337533218,59,8.0,59.08
386003689732726784,38.04769636,-122.14423002,im so bored fuuuuuuuuck,2013-10-04 05:43:45,337533218,59,8.0,59.08
386008965852585984,38.04836839,-122.14529761,"Oh my fucking god , I hate hiccups &amp; they won't fucking go away",2013-10-04 06:04:43,163359139,59,8.0,59.08
386015742623096832,38.04840767,-122.14523736,Idk what Willis doing but I'm gonna fall asleep if he takes any longer ?,2013-10-04 06:31:39,163359139,59,8.0,59.08
386020447277428736,38.0483803,-122.1452227,I'm so tired I can't stay up any longer,2013-10-04 06:50:21,163359139,59,8.0,59.08
386020491728674816,38.04837544,-122.14517634,Will most likely fell asleep on me too,2013-10-04 06:50:31,163359139,59,8.0,59.08
386055714038226944,38.04770423,-122.14426319,is that the berryessa fire I hella smell? like damn,2013-10-04 09:10:29,337533218,59,8.0,59.08
386055917633949696,38.04777986,-122.14422248,grab the wall &amp; drive you craaaaazy,2013-10-04 09:11:17,337533218,59,8.0,59.08
386056236682067968,38.04777974,-122.14422952,why was I just driving and a cops just gonna stop next to me and shine the searchlight dead in my eyes the whole time I was at the light.,2013-10-04 09:12:34,337533218,59,8.0,59.08
386056310057218048,38.04777659,-122.14422014,like yo can I help you?,2013-10-04 09:12:51,337533218,59,8.0,59.08
386227351672979456,38.04838734,-122.14523108,I'm so bored,2013-10-04 20:32:31,163359139,59,8.0,59.08
386229630178299904,38.04837142,-122.14521792,I hope babe does great on his interview !!,2013-10-04 20:41:34,163359139,59,8.0,59.08
386238404058292224,38.04772667,-122.14425485,soooo many Bay Area fires recently holy shit,2013-10-04 21:16:26,337533218,59,8.0,59.08
386238726382161920,38.04782341,-122.14427445,the squeaky boots episode,2013-10-04 21:17:42,337533218,59,8.0,59.08
386238886763978752,38.04778527,-122.14424109,can I look like @_cruelladetrill,2013-10-04 21:18:21,337533218,59,8.0,59.08
386239730402086912,38.04772367,-122.14425354,@_cruelladetrill what ? because you're gorgeous! haha,2013-10-04 21:21:42,337533218,59,8.0,59.08
386240548593340416,38.04781255,-122.14432223,currently: getting ready to hangout with sum man candy??,2013-10-04 21:24:57,337533218,59,8.0,59.08
386240592830672896,38.04781255,-122.14432223,hahaha my tweets are so fucking stupid,2013-10-04 21:25:07,337533218,59,8.0,59.08
386245841637212161,38.04834074,-122.14520794,I'm Finna start cooking so babe will come to my house with a plate all ready for him! Hopefully he gets hired ???,2013-10-04 21:45:59,163359139,59,8.0,59.08
386255455736963072,38.04771377,-122.14428954,how many times is my 5th st exit gonna be on fire I have to drive so deep to get home when I can't get off there haha fuck,2013-10-04 22:24:11,337533218,59,8.0,59.08
386290565618212864,38.04771297,-122.14430354,THE FUCKING VIRGINITY HIT,2013-10-05 00:43:42,337533218,59,8.0,59.08
