id,lat,lng,text,timeStamp,user_id,mb_cluster,db_cluster,cluster
385165599799652352,37.7474063,-122.17263186,What needs to happen Friday: Bartolo goes 7+ innings. We capitalize with RISP. Doolittle comes in shuts down an inn. Then.. Balfour rage ?,2013-10-01 22:13:29,101685071,44,12.0,44.12
385169884297953281,37.74741467,-122.17263896,I'm always underestimated with my football skills. Now these dudes hella mad cuz I'm doggin em,2013-10-01 22:30:31,101685071,44,12.0,44.12
385202934272647168,37.74741666,-122.17263321,Great atmosphere in Pittsburgh. Almost as loud as o.co when it's a sold out crowd. #cueto cueeeetttooooo,2013-10-02 00:41:50,101685071,44,12.0,44.12
385256859059253249,37.74739879,-122.17260961,"Picture perfect, I paint a perfect picture",2013-10-02 04:16:07,101685071,44,12.0,44.12
385556561570955264,37.74740965,-122.1726235,This is Oakland,2013-10-03 00:07:02,101685071,44,12.0,44.12
385636766884958209,37.74740414,-122.17259849,Whyyyyyyeeeeeee (kenan Thompson voice),2013-10-03 05:25:44,101685071,44,12.0,44.12
386313379486248960,37.747412,-122.17261476,lets go baby! rally rally we want a ralllly! #needcrowdnoise #Athletics,2013-10-05 02:14:21,101685071,44,12.0,44.12
386324999134392320,37.74742654,-122.17265822,This man is hittable. Mark my words we will get to scherzer. #LetsGoOakland #Athletics crowd step it the fuck up,2013-10-05 03:00:32,101685071,44,12.0,44.12
386333450552102912,37.74741709,-122.17263302,Lol testing reddicks arm? That's a nono! #MomentumShift #LetsGoOakland,2013-10-05 03:34:07,101685071,44,12.0,44.12
386333718098350080,37.74741709,-122.17263302,LET'S FUCKIN GO LETS GET THIS SHIT STARTED A's! If there was ever a time to rake its right now,2013-10-05 03:35:10,101685071,44,12.0,44.12
