id,lat,lng,text,timeStamp,user_id,mb_cluster,db_cluster,cluster
384561789834244096,37.52041633,-122.00647714,Now this is a slap!?? @Julioooly__ http://t.co/C8MOBJibqK,2013-09-30 06:14:10,89309115,19,15.0,19.15
384562268198801408,37.520445,-122.00645082,Stop oh than wiggle with it,2013-09-30 06:16:04,89309115,19,15.0,19.15
384562381889626113,37.520445,-122.00645082,To the windows to the walls til the sweat drops down my ??????,2013-09-30 06:16:31,89309115,19,15.0,19.15
384563786780123136,37.52044605,-122.00642291,http://t.co/pTNizByVgS,2013-09-30 06:22:06,89309115,19,15.0,19.15
384563883295252481,37.52048641,-122.00643833,???? http://t.co/Cd4zcVZsZO,2013-09-30 06:22:29,89309115,19,15.0,19.15
384565560169615361,37.52042355,-122.0065187,If having a bad bitch was a crime I'd be arrested,2013-09-30 06:29:09,89309115,19,15.0,19.15
384565596223844352,37.5204087,-122.00646624,No help that's all me all me corral,2013-09-30 06:29:17,89309115,19,15.0,19.15
384899198505603072,37.52041143,-122.00647831,Finished the homework early ??,2013-10-01 04:34:54,89309115,19,15.0,19.15
384900286189297664,37.52058633,-122.00654952,RFT“@BestofScorpio: #Scorpio's get tired of the same old so they'll switch it up every once in awhile.”,2013-10-01 04:39:13,89309115,19,15.0,19.15
384921770702012416,37.52036755,-122.00632584,My dad just never stops nagging. If I stay up late to do hw he nags. If I get bad grades he nags. wtf I can never please him,2013-10-01 06:04:36,89309115,19,15.0,19.15
385285336319787008,37.5204481,-122.00649971,Lol,2013-10-02 06:09:17,89309115,19,15.0,19.15
385285537260527616,37.52040187,-122.00641436,I don't like irresponsible ass people.,2013-10-02 06:10:05,89309115,19,15.0,19.15
385285620764917761,37.52040187,-122.00641436,It irritates me.,2013-10-02 06:10:24,89309115,19,15.0,19.15
385285729045069824,37.52039165,-122.00642274,I even hate it when I can't make it somewhere were I said I would,2013-10-02 06:10:50,89309115,19,15.0,19.15
385287136804491264,37.52045569,-122.00656055,Cheating on your significant other just makes you look ridiculous &amp; trashy. No respect for you. Especially if you have a great bf/gf.,2013-10-02 06:16:26,89309115,19,15.0,19.15
385287699449401345,37.52045551,-122.00649831,Now that I got that out of the way. Goodnight ?,2013-10-02 06:18:40,89309115,19,15.0,19.15
385294666876203008,37.52042761,-122.00645643,I tweet what I want if you get offended by my tweets I'm sorry to hear that but I do not care,2013-10-02 06:46:21,89309115,19,15.0,19.15
385295050713755648,37.52040535,-122.00644897,If the shoe fits wear it,2013-10-02 06:47:53,89309115,19,15.0,19.15
385611819756183552,37.52044495,-122.00653244,I got the biggest big bite on my chin.,2013-10-03 03:46:36,89309115,19,15.0,19.15
385613463088668672,37.52044008,-122.00657023,@drewcodrington &amp; I get so frustrated in pe. So annoying &amp; boring,2013-10-03 03:53:08,89309115,19,15.0,19.15
385906308613828608,37.52047364,-122.0065355,I hate texting Julissa because she never replys. Great,2013-10-03 23:16:48,89309115,19,15.0,19.15
385939558916833280,37.52040485,-122.00653273,?,2013-10-04 01:28:55,89309115,19,15.0,19.15
385996640516964353,37.5206106,-122.00657451,Honesty today was pretty successful,2013-10-04 05:15:45,89309115,19,15.0,19.15
386239757035905025,37.52039297,-122.00655561,“@_TheThirdEye_: http://t.co/vtnYLA8dnD”,2013-10-04 21:21:48,89309115,19,15.0,19.15
