id,lat,lng,text,timeStamp,user_id,mb_cluster,db_cluster,cluster
378159312624828416,37.32473131,-121.77822933,@VivaLa_Steena sounds like a plan! ?,2013-09-12 14:13:00,555742290,97,13.0,97.13
378159630464987137,37.32465053,-121.77823599,Omg. Shut uppppppp. Can you &amp; your obnoxious laugh go somewhere else?,2013-09-12 14:14:16,555742290,97,13.0,97.13
378165237083406336,37.32474256,-121.77766633,"Happy Birthday my sassiest princess @yourpalvaalzz ??? I hope you have a fabulous day, I love you bb??",2013-09-12 14:36:33,107248301,97,13.0,97.13
378167437641789441,37.32475296,-121.77767279,“@kirannsinngh: Lol this is so true http://t.co/XQqYVkxPTg”,2013-09-12 14:45:17,107248301,97,13.0,97.13
378187184848646144,37.32392456,-121.7777562,Just failed my ap gov quiz...,2013-09-12 16:03:45,535193804,97,13.0,97.13
378191734418587649,37.32485464,-121.77785145,Im pissed I failed my quiz...aghhhh,2013-09-12 16:21:50,535193804,97,13.0,97.13
378192303732453376,37.32386698,-121.77758718,DREAMTEAM! #dreamteam ??? @rafaelyyyyy @paaulc,2013-09-12 16:24:06,1067376919,97,13.0,97.13
378199043014262784,37.32382595,-121.77755475,My morning was pretty ?? but i taught myself to not let anything bug me. ? #staypositive,2013-09-12 16:50:53,1067376919,97,13.0,97.13
378201330151473152,37.3238483,-121.7776007,My homie @BrandonGarzaa #chango http://t.co/z1k9vBM9Z6,2013-09-12 16:59:58,1067376919,97,13.0,97.13
378202152117620736,37.32386153,-121.77758248,“@CWAthletes: Destroying a team that talked trash before the game &gt;” @rafaelyyyyy,2013-09-12 17:03:14,1067376919,97,13.0,97.13
378262664943644672,37.32308969,-121.77749561,??,2013-09-12 21:03:41,555742290,97,13.0,97.13
378272301155766273,37.32466809,-121.77829927,@twypoppunk @nicksteinborn @headabovewater Please play Hostels &amp; Brothels on #HousePartyTour #poppunk #thewonderyears,2013-09-12 21:41:59,535193804,97,13.0,97.13
378272713514561536,37.32466809,-121.77829927,@AllTimeLow @AlexAllTimeLow @JackAllTimeLow @zackalltimelow @riandawson Id b so happy if u play Break Your little heart on #HousePartyTour,2013-09-12 21:43:37,535193804,97,13.0,97.13
378359978047709184,37.3254574,-121.77768883,Pumpkins...already? http://t.co/TaNiaK36rF,2013-09-13 03:30:23,60159591,97,13.0,97.13
378520880873095169,37.32445441,-121.77816092,I sprayed perfume on my shirt &amp; now it has spots all over it. ?,2013-09-13 14:09:45,555742290,97,13.0,97.13
378550883455623168,37.3246491,-121.77835244,@soswaveyy_ OMG ???,2013-09-13 16:08:58,107248301,97,13.0,97.13
378551541637984257,37.32458486,-121.77833721,Finally it's Friday?? It seriously felt like 5 years long.,2013-09-13 16:11:35,107248301,97,13.0,97.13
378580378040008704,37.32437117,-121.77776705,“@TheFactsBook: People who are left-handed are 39% more likely to be homosexual.” Lawl,2013-09-13 18:06:10,1067376919,97,13.0,97.13
378587758136012800,37.32414498,-121.7779489,Idk why but her voice just fuckin annoys me.. Lol,2013-09-13 18:35:30,1067376919,97,13.0,97.13
378631256109367296,37.32323891,-121.77803228,@itsfreakinganna tfti nigguh http://t.co/23rZ1k93on,2013-09-13 21:28:20,1415840640,97,13.0,97.13
378636447240028160,37.32316627,-121.77805365,#swagfolder http://t.co/0XfpavCr7s,2013-09-13 21:48:58,1415840640,97,13.0,97.13
379725756727033856,37.32347979,-121.77698247,"Someone like you, more like someone unlike you or something that's familiar maybe.",2013-09-16 21:57:30,1002558061,97,13.0,97.13
379726439920443392,37.32346185,-121.777001,Lauryn Hill's Ex-Factor will always be a favorite.,2013-09-16 22:00:12,1002558061,97,13.0,97.13
379997407640961024,37.32396935,-121.77777632,New STATE CHAMPS song is keeping pop punk &amp; music alive! Check it out! http://t.co/7tHxMYRVT1 #statechamps #thefinerthings #poppunk #music,2013-09-17 15:56:56,535193804,97,13.0,97.13
379997713930006530,37.32396935,-121.77777632,Check out the new State Champs song http://t.co/7tHxMYRVT1 @NathanHuynh3,2013-09-17 15:58:09,535193804,97,13.0,97.13
379998165346160640,37.32389212,-121.77766527,@State_Champs @dereksteez @RivalDiaz @AggroEvan good job on the new song! Best I've heard in a whole. U guys keep music alive,2013-09-17 15:59:57,535193804,97,13.0,97.13
380001801816129536,37.32328093,-121.7782854,"Gross, don't whistle at me. You're old. ?",2013-09-17 16:14:24,555742290,97,13.0,97.13
380002146428530688,37.3232448,-121.77832443,P building straight smells like weeeeeeeeeeed.,2013-09-17 16:15:46,555742290,97,13.0,97.13
380026602500800513,37.32439802,-121.77782686,@Skrillex Leaving Ep. Is very depressing. I can feel the emotions in it.,2013-09-17 17:52:57,1067376919,97,13.0,97.13
380032464824975360,37.32388054,-121.77772659,All the guys that dressed up all look so handsome and spiffy! ??,2013-09-17 18:16:14,107248301,97,13.0,97.13
380032581971869696,37.32388762,-121.77773764,All the guys that dressed up today look so handsome and spiffy! ??,2013-09-17 18:16:42,107248301,97,13.0,97.13
380066344437178368,37.32374325,-121.77766347,@namratachalla Suppy. When do u wanna meet up for the Key-Interact SJ Skate fundraiser money?,2013-09-17 20:30:52,535193804,97,13.0,97.13
380340057967579136,37.32358039,-121.77751646,That moment when you walk into class &amp; realize you have a quiz.. Shit!! But its actually a test ..FUCKing A!!!?,2013-09-18 14:38:30,1067376919,97,13.0,97.13
380695664826388480,37.32464782,-121.77849939,I am so sore. ?,2013-09-19 14:11:34,555742290,97,13.0,97.13
380702999309328384,37.32363754,-121.77753371,"@jannette_05 you made my phone go,""Shuttt the fuck uppp."" Hahaha i forgot to turn it on vibrate ??",2013-09-19 14:40:42,1067376919,97,13.0,97.13
380704346746257408,37.32475755,-121.77761442,Kinda regret updating my phone...,2013-09-19 14:46:04,107248301,97,13.0,97.13
380705834067451906,37.32367494,-121.7775624,This song never gets old?? #cinema #bennybenassi #Skrillex #remix #lyrics http://t.co/HhgxzJpcYc,2013-09-19 14:51:58,1067376919,97,13.0,97.13
380711990898876416,37.32467545,-121.77830991,Ms. Li said there are only 2 people passing her class and I'm one of them. ?,2013-09-19 15:16:26,555742290,97,13.0,97.13
380738314472415232,37.32377194,-121.77764575,Guys is this fucking throwback or what!? #mtv #celebritydeathmatch http://t.co/9K9ZiNbo9C,2013-09-19 17:01:02,1067376919,97,13.0,97.13
380743030690443264,37.3237745,-121.7784001,I seriously love Cheli's class.,2013-09-19 17:19:47,555742290,97,13.0,97.13
380753644682887168,37.32335637,-121.77805059,In class sooooo bored students are just presenting projects #classroom,2013-09-19 18:01:57,931384538,97,13.0,97.13
380757908750753792,37.32390659,-121.77767255,A deep ocean of secrets.,2013-09-19 18:18:54,107248301,97,13.0,97.13
380759595133579264,37.32388413,-121.77767475,Ooooops. ? http://t.co/12rZDlqm47,2013-09-19 18:25:36,107248301,97,13.0,97.13
380777392718884864,37.3235105,-121.77764871,I love the music they're playing in the quad. ??,2013-09-19 19:36:19,555742290,97,13.0,97.13
381062137876996096,37.32365492,-121.77777269,Wow i barley noticed my hair is so fucking perfect today! ?,2013-09-20 14:27:48,1067376919,97,13.0,97.13
381111833270054912,37.32379997,-121.77757176,Fuck school I just want to sleep ?,2013-09-20 17:45:16,1411136378,97,13.0,97.13
381112866671046656,37.32420293,-121.77789,Today's going by slow... I'm so excite for tonight. #HousePartyTour pop punk concert!,2013-09-20 17:49:22,535193804,97,13.0,97.13
381116261821739009,37.32390038,-121.77769141,I want to go salsa dancing??,2013-09-20 18:02:52,107248301,97,13.0,97.13
381138098781822976,37.32366724,-121.77773741,"@VivaLa_Steena @Vaughan_On nah nah nah. I'm a boss ass bitch! bitch, bitch, bitch.",2013-09-20 19:29:38,555742290,97,13.0,97.13
381138110836244481,37.32471147,-121.77770291,TONIGHT! So stoked! #HousePartyTour #poppunk #adtr #atl #twy #defendpoppunk http://t.co/HOi9gWsbJC,2013-09-20 19:29:41,535193804,97,13.0,97.13
381138522758856704,37.32364398,-121.77771963,You're annoying. Stop. ??,2013-09-20 19:31:19,555742290,97,13.0,97.13
381141934808395776,37.32391498,-121.7783407,"Can you take your annoying laugh, and go somewhere else? ?",2013-09-20 19:44:53,555742290,97,13.0,97.13
381152531423846400,37.323771550000004,-121.77761382,FUCK U CO. Stupid viet teacher. How the fuck is gettin up &amp; whisperin can I go 2 the bathroom causin a scene? And u let others use the rr...,2013-09-20 20:26:59,535193804,97,13.0,97.13
381159981594062848,37.32469166,-121.77772068,"""Don't lose the goodies."" ? @tjlocs @Olivviaaa_",2013-09-20 20:56:35,555742290,97,13.0,97.13
381159993090646017,37.32375205,-121.77763319,Get me out of this class????,2013-09-20 20:56:38,535193804,97,13.0,97.13
382165752632975360,37.32388734,-121.77773502,All my guy friends r so rude. Ignores everything. Y can't they just be a good listener like me?,2013-09-23 15:33:10,535193804,97,13.0,97.13
382240699418038272,37.32379131,-121.77761887,@daylightband,2013-09-23 20:30:59,535193804,97,13.0,97.13
382240816657207296,37.32376147,-121.77760432,"@daylightband play a show in San Jose, Ca, USA",2013-09-23 20:31:27,535193804,97,13.0,97.13
382241155947065344,37.32376147,-121.77760432,I want Domino's pizza so  I'm getting it with my friends after school,2013-09-23 20:32:47,535193804,97,13.0,97.13
382243062656692225,37.32372976,-121.77757242,hi ?,2013-09-23 20:40:22,107248301,97,13.0,97.13
382244358365265920,37.32376165,-121.7776083,get me ice cream ??,2013-09-23 20:45:31,107248301,97,13.0,97.13
382246118332960768,37.32374074,-121.77763247,Who brings a laptop for viet class...? LOL,2013-09-23 20:52:31,535193804,97,13.0,97.13
382523861884891136,37.32472599,-121.77767139,Ling Ling making some bomb ass donuts! ? @emilyyvo,2013-09-24 15:16:10,1411136378,97,13.0,97.13
382534397359951872,37.32455509,-121.7782886,I seriously had the weirdest dream last night...,2013-09-24 15:58:02,107248301,97,13.0,97.13
382538586710474752,37.32447989,-121.77835674,I have goosebumps on my boobs.,2013-09-24 16:14:40,107248301,97,13.0,97.13
382568939403747330,37.32383798,-121.77763468,"Mr. Fanciullo talks really loud when he does his lectures...Like I get you're really passionate about politics, but calm down dude?",2013-09-24 18:15:17,107248301,97,13.0,97.13
382875366345297920,37.32364062,-121.77770761,This scratch on my screen is annoying! Thanks ?!,2013-09-25 14:32:55,1067376919,97,13.0,97.13
382879619445035008,37.32513271,-121.77845885,@VivaLa_Steena lol. Love you too. ?,2013-09-25 14:49:49,555742290,97,13.0,97.13
382879966704046080,37.32440477,-121.77832508,I love that Ms. Li actually likes me. She's actually helping me and being lenient with me. ?,2013-09-25 14:51:12,555742290,97,13.0,97.13
382880355847380993,37.32453046,-121.77894535,I'm wearing my fucked up Uggs today.. ??,2013-09-25 14:52:45,555742290,97,13.0,97.13
382933465852682240,37.32411654,-121.77800926,@marilolhottie18 @guizar_cynthia @gina_garciaaa I love you guys too??,2013-09-25 18:23:47,576933765,97,13.0,97.13
382947629107126273,37.32341994,-121.77756335,@xoxo_thaalia I'm all by myself ?,2013-09-25 19:20:04,576933765,97,13.0,97.13
382950171853590529,37.32340784,-121.77750267,I hate Ms. Quiroga's Spanish class ?,2013-09-25 19:30:10,1150082719,97,13.0,97.13
382953671295655936,37.32346416,-121.77764883,I really don't wanna go to 7th,2013-09-25 19:44:04,576933765,97,13.0,97.13
382974306415673344,37.32574292,-121.77830816,I hate waiting by myself to get picked up,2013-09-25 21:06:04,576933765,97,13.0,97.13
382975574978736128,37.32572794,-121.7782899,@xoxo_thaalia we had to do this thing where we have to come up with a product to sell during lunch time! You're my partner though lol,2013-09-25 21:11:07,576933765,97,13.0,97.13
383256043796439042,37.3242948,-121.7777099,IG : tw7rkonmyface,2013-09-26 15:45:36,495409900,97,13.0,97.13
383258163899682816,37.3243268,-121.7777037,69 witta bad chick witta fat a$$ &gt;,2013-09-26 15:54:01,495409900,97,13.0,97.13
383260014254620673,37.3243662,-121.7776886,"believe me,  these hoes they choosin",2013-09-26 16:01:22,495409900,97,13.0,97.13
383265851752734721,37.3246074,-121.7776805,#ThingsIGetAlot I'm mean.,2013-09-26 16:24:34,495409900,97,13.0,97.13
383266418940051457,37.3246074,-121.7776805,#ThingsIGetAlot I'll send you a nude if you send one.,2013-09-26 16:26:49,495409900,97,13.0,97.13
383266997812748288,37.32326296,-121.77803781,Feeling really good about my Stats test?,2013-09-26 16:29:07,107248301,97,13.0,97.13
383268764252270592,37.3245986,-121.7776866,"""@dijonfashoo: @Tw7rkonmyFace you're not mean ?"" THANKS WHOADEEE",2013-09-26 16:36:08,495409900,97,13.0,97.13
383269676207198208,37.3245791,-121.7777335,@dijonfashoo yaa I live in Cali na,2013-09-26 16:39:46,495409900,97,13.0,97.13
383270160997441536,37.3245791,-121.7777335,#ThingsIGetAlot  Omg STOP #BigDickProblems,2013-09-26 16:41:41,495409900,97,13.0,97.13
383270601160290304,37.3245949,-121.7777138,Let's be honest na,2013-09-26 16:43:26,495409900,97,13.0,97.13
383271009010216960,37.3245949,-121.7777138,make her do thangs she nevva done before,2013-09-26 16:45:04,495409900,97,13.0,97.13
383293224787247106,37.32379572,-121.77777329,Being Mr. Ramirez' student aid is gonna be the easiest thing,2013-09-26 18:13:20,576933765,97,13.0,97.13
383347070590939136,37.323302,-121.7774994,"""@VFROMTHEPVXKK: whatever . Plans this weeknd &gt;&gt;&gt;&gt;&gt;"" fasho",2013-09-26 21:47:18,495409900,97,13.0,97.13
383350887218831361,37.32469136,-121.77818656,Wow some kid in my 7th said I was too short to be a senior ?,2013-09-26 22:02:28,576933765,97,13.0,97.13
383597923948179456,37.3234167,-121.7780237,OH SHITT T IS EARLY RELEASE TODAY ! FUCKERRR IN ER AUZZZZ,2013-09-27 14:24:06,495409900,97,13.0,97.13
383636667841511424,37.32388505,-121.77848057,@dragoncatdaisy just made my day with what she told me ??,2013-09-27 16:58:03,107248301,97,13.0,97.13
383636896418521089,37.3246571,-121.7782044,Wtf this mufucka said the library closed,2013-09-27 16:58:58,495409900,97,13.0,97.13
383654679130828800,37.32411077,-121.77802937,@rafaelyyyyy hooked me up with an air freshener for my locker ? #pbj http://t.co/kZfpnsAOIJ,2013-09-27 18:09:38,1067376919,97,13.0,97.13
383663337680035840,37.3246686,-121.7776341,Leanin,2013-09-27 18:44:02,495409900,97,13.0,97.13
383663396211535872,37.3246686,-121.7776341,That purrp got you feenin,2013-09-27 18:44:16,495409900,97,13.0,97.13
383666518757634048,37.3246544,-121.777633,Hour nd thirty mo minutes,2013-09-27 18:56:40,495409900,97,13.0,97.13
383674824859475968,37.3245864,-121.7779388,"Ghetto word of the day ""cologne"" 

Aye bruh you think you cologne me a dolla?",2013-09-27 19:29:41,495409900,97,13.0,97.13
384146153253519360,37.32402757,-121.77939532,Just saw the trailer for @EmilioTheMovie - movie looks dope! Can't wait to see it. @walterperez you the man,2013-09-29 02:42:34,371304881,97,13.0,97.13
384681938583183361,37.3234619,-121.7780215,If she cum hard she betta come legit,2013-09-30 14:11:35,495409900,97,13.0,97.13
384691449779855361,37.3233972,-121.7779698,"""@abbybeverlyy: All guys dress the same"" LOL",2013-09-30 14:49:23,495409900,97,13.0,97.13
384691579547426816,37.3233972,-121.7779698,fuck swag on some real shit,2013-09-30 14:49:54,495409900,97,13.0,97.13
384692031299133441,37.3234177,-121.7779556,oh well you must not know me let me change that,2013-09-30 14:51:42,495409900,97,13.0,97.13
384693457148600321,37.3233193,-121.7779569,She got the ass to be my wife,2013-09-30 14:57:22,495409900,97,13.0,97.13
384695707858255872,37.3246375,-121.7782756,@paweeeena achey breaky heart http://t.co/Lk7N03SUef,2013-09-30 15:06:18,1415840640,97,13.0,97.13
384705185454379008,37.3241469,-121.7776741,Ladies retweet if you gotta jump up and down to fit that ass in yo jeans,2013-09-30 15:43:58,495409900,97,13.0,97.13
384705251715993600,37.3241469,-121.7776741,You can get the buisness,2013-09-30 15:44:14,495409900,97,13.0,97.13
384727694350364672,37.32328846,-121.77799133,Made my morning better ?? RT “@_LadyBoners: Dylan :) http://t.co/kabqMNTBd0”,2013-09-30 17:13:24,107248301,97,13.0,97.13
384745778540867585,37.32378216,-121.77783914,@dreaaesparza I missed you today ?,2013-09-30 18:25:16,576933765,97,13.0,97.13
384745797872406529,37.3246539,-121.7782609,I live in San Jose and got money in My pocket my nigga,2013-09-30 18:25:21,495409900,97,13.0,97.13
384745958556188672,37.3246557,-121.7782349,pray for those who are affected by the government,2013-09-30 18:25:59,495409900,97,13.0,97.13
384746304389132288,37.32379469,-121.77781878,"I seriously just sit here and do nothing, but I get my 10 credits still so I guess that's pretty chill ?",2013-09-30 18:27:21,576933765,97,13.0,97.13
384746476724703233,37.3246575,-121.7782531,P.A.P.E.R,2013-09-30 18:28:02,495409900,97,13.0,97.13
384765273128960000,37.3245963,-121.7776972,"You know what yo, you a bitch",2013-09-30 19:42:44,495409900,97,13.0,97.13
384765436484534273,37.3245963,-121.7776972,You gon be hot for awhile but I'm gon be rich forever,2013-09-30 19:43:23,495409900,97,13.0,97.13
385053999440723968,37.32328881,-121.77826363,At school right now... Hate tests? #schooleveryday  #morning,2013-10-01 14:50:02,931384538,97,13.0,97.13
385060724214464512,37.32457309,-121.77833573,Hello there October! I've been waiting for this month forever! ????,2013-10-01 15:16:45,107248301,97,13.0,97.13
385066275338063873,37.3242872,-121.7777033,Chuckin' up the deuces,2013-10-01 15:38:48,495409900,97,13.0,97.13
385071511100334081,37.32450386,-121.77834239,People who are really bad at whispering...Like I can still hear your conversation.,2013-10-01 15:59:37,107248301,97,13.0,97.13
385076779104227328,37.3246181,-121.7776271,I'm startin fresh everyday Fuck my past,2013-10-01 16:20:33,495409900,97,13.0,97.13
385080337253953536,37.3246387,-121.7776282,Christianity : Equality,2013-10-01 16:34:41,495409900,97,13.0,97.13
385093960693075968,37.3247196,-121.7782211,RIP !,2013-10-01 17:28:49,495409900,97,13.0,97.13
385103660146900992,37.32434161,-121.77777711,?? So who has a Great America Gold Pass? Anyone? ? ??,2013-10-01 18:07:22,1067376919,97,13.0,97.13
385113320551751680,37.324114,-121.77798575,Witnessing people take out their wedgie and they know you saw is pretty funny,2013-10-01 18:45:45,576933765,97,13.0,97.13
385120592103354368,37.32326217,-121.77718811,InstaGram : tw7rkonmyface,2013-10-01 19:14:39,495409900,97,13.0,97.13
385120999689039872,37.32412365,-121.77796957,I wanna go home,2013-10-01 19:16:16,576933765,97,13.0,97.13
385121062385500160,37.32415916,-121.77793265,My stomach is killin' me?,2013-10-01 19:16:31,576933765,97,13.0,97.13
385126045986222080,37.32366139,-121.7780441,This trill shit is easy,2013-10-01 19:36:19,495409900,97,13.0,97.13
385126088826822656,37.32366139,-121.7780441,Yo girl love me accent,2013-10-01 19:36:29,495409900,97,13.0,97.13
385126267776815104,37.32366139,-121.7780441,Can I be yo main bitch is what yo bitch be askin' I'm laughin,2013-10-01 19:37:12,495409900,97,13.0,97.13
385130665986891776,37.32390362,-121.77864578,?,2013-10-01 19:54:40,576933765,97,13.0,97.13
385132145817038848,37.3242633,-121.7778131,He said but she put out though bruh lmao fuck dat hoe,2013-10-01 20:00:33,495409900,97,13.0,97.13
385145258851332096,37.3245913,-121.7778892,Dam girl you deserve rounds,2013-10-01 20:52:40,495409900,97,13.0,97.13
385428780333809664,37.3243485,-121.7777045,These rap niggas gone r&amp;b and shit! #Shifty&amp;Shitty,2013-10-02 15:39:16,495409900,97,13.0,97.13
385433604102184960,37.3242999,-121.7777096,A SNEAK DISSSA THASS THAT SHIT I DONT LIKE !,2013-10-02 15:58:26,495409900,97,13.0,97.13
385434564773965824,37.3242999,-121.7777096,"Niggas be mugging me, You know I'm muggin back",2013-10-02 16:02:15,495409900,97,13.0,97.13
385435256779587585,37.3245977,-121.7776865,It's cold out here I like this shit #AllBlack #Hoodie shit,2013-10-02 16:05:00,495409900,97,13.0,97.13
385447451395489792,37.32299023,-121.77789721,"Why you hatin' on me, nigga, I'm just livin' My life!",2013-10-02 16:53:28,495409900,97,13.0,97.13
385447546622980097,37.32299023,-121.77789721,"I just want the money,  you can keep them bitches",2013-10-02 16:53:51,495409900,97,13.0,97.13
385447631578611712,37.32285647,-121.77785812,just young and I'm gettin' it,2013-10-02 16:54:11,495409900,97,13.0,97.13
385449107273166848,37.32294883,-121.77758748,Reppin #FroGang http://t.co/ArybzOn6TS,2013-10-02 17:00:03,495409900,97,13.0,97.13
385468733533081600,37.32421056,-121.77788495,OMG eww @CarbajalSabrina ??,2013-10-02 18:18:02,576933765,97,13.0,97.13
385480435750297601,37.32365108,-121.77750112,Kim made me one of the best peppermint mocha's I ever had?,2013-10-02 19:04:32,107248301,97,13.0,97.13
385501614586331137,37.32336728,-121.77756278,Drop top Rolls Royce on the way,2013-10-02 20:28:41,495409900,97,13.0,97.13
385501677710614528,37.32336728,-121.77756278,Wassup redbone,2013-10-02 20:28:56,495409900,97,13.0,97.13
385501791007170560,37.32336728,-121.77756278,Wassup caramel,2013-10-02 20:29:23,495409900,97,13.0,97.13
385786509585952769,37.32457352,-121.778318,I guess art class is fun sometimes? http://t.co/jTvPYu3sjQ,2013-10-03 15:20:46,107248301,97,13.0,97.13
385832038315462656,37.32388257,-121.77769505,Happy Birthday @CesarXFernandez ??,2013-10-03 18:21:41,107248301,97,13.0,97.13
385832212735602688,37.32388257,-121.77769505,People are still asking me for grad trip forms........,2013-10-03 18:22:22,107248301,97,13.0,97.13
385841694853189632,37.32324073,-121.77712011,"""@BlackAssPics: http://t.co/RTQrWBbl6d""",2013-10-03 19:00:03,495409900,97,13.0,97.13
386146630258262017,37.3232542,-121.7779352,drake the type of nigga to tell the class to sit back down when the bell rings and wait for the teacher to dismiss them.,2013-10-04 15:11:45,495409900,97,13.0,97.13
386148160638156801,37.3243434,-121.7776941,2 more days till tryouts! ?,2013-10-04 15:17:50,495409900,97,13.0,97.13
386150421380624384,37.3243067,-121.7777131,bored as hell.. ?? http://t.co/l5fMWpPCvM,2013-10-04 15:26:49,495409900,97,13.0,97.13
386157571226075136,37.3242805,-121.777713,drose birthday today. S/o,2013-10-04 15:55:14,495409900,97,13.0,97.13
386162280154411008,37.3243321,-121.7777049,"""@_TupacsWidow: Why black mannequins be having exaggerated lips &amp; big noses!? lmfao now thats just wrong"" they be bald af too wit no arms ?",2013-10-04 16:13:56,495409900,97,13.0,97.13
386164532478889984,37.3246125,-121.7776558,"im a fuckin baller, yall dont get it do you??",2013-10-04 16:22:53,495409900,97,13.0,97.13
386173259751776256,37.32325177,-121.77800905,I feel like my twitter randomly unfollows people...,2013-10-04 16:57:34,107248301,97,13.0,97.13
386184525354512385,37.324305,-121.77786349,I had a dream @Fluxpavilion &amp; @ImFigure had a show together ??.. To bad it was a dream...,2013-10-04 17:42:20,1067376919,97,13.0,97.13
386184757664428032,37.324323,-121.77787916,"“@MostSecretFacts: Scientist say, our dreams can often warn us of things that have yet to happen.” I see this after my last tweet?? Mindown.",2013-10-04 17:43:15,1067376919,97,13.0,97.13
386185260733435904,37.32431421,-121.77784774,"“@MostSecretFacts: Scientist say, our dreams can often warn us of things that have yet to happen.”i see this after my last tweet??Mindblown",2013-10-04 17:45:15,1067376919,97,13.0,97.13
386197183810138113,37.32417281,-121.7778492,People with big ass backpacks need to make them smaller cause some girl almost fucking hit me in my face like wtf dude,2013-10-04 18:32:38,576933765,97,13.0,97.13
386197726720839680,37.32411257,-121.77799895,@yipeeitspreslli same,2013-10-04 18:34:47,576933765,97,13.0,97.13
386208894617260032,37.32412989,-121.77796618,@Mannylopez002 dude I miss you too?,2013-10-04 19:19:10,576933765,97,13.0,97.13
386210852396756993,37.323253,-121.7770683,If i fart and you stay with me its real ??,2013-10-04 19:26:57,495409900,97,13.0,97.13
386211543106334720,37.323253,-121.7770683,@VFROMTHEPVXKK REAL AF ??,2013-10-04 19:29:42,495409900,97,13.0,97.13
386217844855169025,37.3246663,-121.7776314,I came up from nothin they dont even know,2013-10-04 19:54:44,495409900,97,13.0,97.13
386218166528901121,37.324629,-121.7777482,I play the game like im Kobe ?,2013-10-04 19:56:01,495409900,97,13.0,97.13
386218370963476481,37.324629,-121.7777482,Pocket 100s in my right pocket 50s in my left,2013-10-04 19:56:49,495409900,97,13.0,97.13
386221121038602240,37.3245705,-121.777886,she like lightskin dick,2013-10-04 20:07:45,495409900,97,13.0,97.13
386221247161311232,37.3245705,-121.777886,Hoe s t f up !,2013-10-04 20:08:15,495409900,97,13.0,97.13
386244624244699139,37.32473905,-121.77762465,Fuckkk,2013-10-04 21:41:09,1723778940,97,13.0,97.13
386244756939874306,37.32473905,-121.77762465,I don't even want to be here......,2013-10-04 21:41:40,1723778940,97,13.0,97.13
